question,feedback,score,thought,orig_answer,resub_answer,rubric
How does the presence of various vegetables impact the overall atmosphere and message of this scene?,"Much better! You have included specific vegetables and mentioned the bushel basket and potted plant, which adds more detail to your answer. To improve further, you could elaborate on how the variety of produce promotes a nutritious lifestyle and the importance of embracing the diversity of nature's offerings. This will help to fully capture the overall atmosphere and message of the scene.",8,I need to mention specific vegetables and the additional elements in the scene to provide a more detailed answer.,"The presence of various vegetables, such as carrots, potatoes, squash, and collards, on the wooden dining table creates an atmosphere of health and freshness. The assortment of fresh vegetables emphasizes the importance of a balanced diet and healthy eating habits. Additionally, the bushel basket and potted plant in the scene highlight the value of natural and farm-fresh produce.","The presence of several vegetables, including carrots, potatoes, squash, and collards, gathered on the wooden dining table contributes to an atmosphere of health, freshness, and abundance. The assortment of fresh vegetables signifies a focus on a balanced diet, promoting the message of healthy eating habits and the importance of including diverse produce in meals. The image also highlights the value of natural and farm-fresh produce, which is further emphasized by the bushel basket and potted plant in the scene. Thus, the overall atmosphere and message of this setting is about promoting a nutritious lifestyle and embracing the variety of produce nature has to offer.",Clarity of Thought: The original thought is focused and relevant to the question. Accuracy: The answer does not fully align with the expected response. Detail: The answer lacks sufficient detail.
How does the use of cell phones at the table impact the social dynamics among the group?,"Much better! You have added important details about the sense of detachment and feelings of exclusion. To further improve, you could mention how this behavior affects the overall sense of camaraderie and connection among the group, and how it might reduce satisfaction with the social interaction for other members.",8,I need to elaborate on how cell phone use affects the group's connection and feelings of exclusion.,"The use of cell phones at the table can make people less engaged in the conversation and more focused on their devices. This behavior can create a sense of detachment among the group members, making them feel less connected to each other. It can also lead to feelings of exclusion for those who are not using their phones, as they might feel ignored or less important.","The use of cell phones at the table can make people less engaged in the conversation and more focused on their devices. This behavior can create a sense of detachment among the group members, making them feel less connected to each other. It can also lead to feelings of exclusion for those who are not using their phones, as they might feel ignored or less important. Additionally, this can hinder the overall sense of camaraderie and connection among the group, reducing satisfaction with the social interaction for other members.",Clarity of Thought: The original thought is focused and relevant to the question. Accuracy: The answer does not fully align with the expected response. Detail: The answer lacks sufficient detail.
How does this place efficiently showcase its offerings and use the space available?,"Much better! You have now included details on how the sushi sign attracts customers and informs them about the options, as well as how the miniature refrigerator allows for compact storage. You also mentioned the person standing behind the sushi sign, which is a good observation. To further improve, you could add a bit more detail about the visual appeal of the sushi sign and how it specifically highlights the assorted sushi options.",8,I need to elaborate on how the sushi sign and refrigerator contribute to the efficient use of space and mention the person behind the sushi sign.,"The place uses the space efficiently by placing a sushi sign on the counter that visually attracts customers and informs them about the available options. The miniature refrigerator allows for compact storage of perishable items without taking up too much space. Additionally, having a person standing behind the sushi sign instead of in front or to the side of it demonstrates clever use of the available space.","The place uses the space efficiently by placing a visually appealing sushi sign on the counter that highlights the assorted sushi options for potential customers. This visual approach attracts attention and informs customers about what is available for purchase. The miniature refrigerator allows for compact storage of perishable items, such as sushi ingredients or beverages, without taking up too much space. Additionally, having a person standing behind the sushi sign instead of in front or to the side of it demonstrates clever use of the available space.",Clarity of Thought: The original thought is focused and relevant to the question. Accuracy: The answer does not fully align with the expected response. Detail: The answer lacks sufficient detail.
How has this living room been uniquely decorated to bring the outdoors inside?,"Great improvement! You have now included the potted plants and the furniture in your answer, which makes it more complete. However, you missed mentioning that the tree mural is specifically on the corner wall and that the birds are flying across the walls. Adding these details will make your answer even more accurate and detailed.",8,I need to include more details about the potted plants and the furniture to improve my answer.,"The living room has been uniquely decorated to bring the outdoors inside by incorporating a tree mural on the wall and birds painted around it. There are also potted plants placed around the room, which add a natural touch. The room is furnished with a couch and a coffee table, creating a cozy and comfortable atmosphere.","The living room has been uniquely decorated to bring the outdoors inside by incorporating a tree mural on the corner wall and having various flying birds painted across the walls. There are also potted plants placed around the room, which add a natural touch. The room is furnished with a couch and a coffee table, creating a cozy and comfortable atmosphere.",Clarity of Thought: The original thought is focused and relevant to the question. Accuracy: The answer does not fully align with the expected response. Detail: The answer is detailed and provides thorough insight.
How is the restaurant table arranged and what type of meal is being served?,"Your answer is now very detailed and almost complete. You have correctly identified the tableware items, the types of food, and the type of meal. The only minor detail missing is the mention of the chairs for seating, which contribute to the comfortable setting for guests.",9,"I need to include the knife and fork, specify the sandwich type, mention the cup of coffee, and suggest the type of meal.","The restaurant table is arranged with a blue tablecloth and has white plates, a cup, a wine glass, a knife, and a fork. There is a croissant sandwich and a salad on the plates, and a cup of coffee is also present. This suggests it might be a lunch or brunch meal.","The restaurant table is arranged with a blue tablecloth and has white plates, a cup, a wine glass, a knife, and a fork. There is a croissant sandwich and a salad on the plates, and a cup of coffee is also present. This suggests it might be a lunch or brunch meal. The table is accompanied by chairs for seating, making it a comfortable setting for guests to enjoy their meal.",Clarity of Thought: The original thought is focused and relevant to the question. Accuracy: The answer is accurate and aligns with expectations. Detail: The answer is detailed and provides thorough insight.
"How many people can be seen watching the two motorcyclists, and what could be the risks involved in such a performance?","You correctly identified some of the risks involved in the performance, such as the possibility of crashing or losing control. However, your count of the spectators is not accurate. There are actually 13 people watching the performance. Additionally, you could provide more details about the specific risks to both the performers and the audience, and mention the importance of safety measures.",6,"The image shows two motorcyclists performing a stunt in mid-air, and there are several people watching them. I need to count the number of spectators and consider the risks involved in such a performance.","There are around 20 people watching the two motorcyclists. The risks involved in such a performance include the possibility of the motorcyclists crashing or losing control, which could lead to injuries for both the performers and the audience. The audience might also be at risk if they are too close to the stunt area.","There are 13 people watching the two motorcyclists. The risks involved in such a performance include the possibility of the motorcyclists losing control, crashing, or colliding with each other, which could result in severe injuries. The audience might be at risk if they are too close to the stunt area, as a motorcycle could go out of control and fall towards the spectators. It is important to have safety measures in place, such as maintaining an adequate distance between the performers and the audience, and ensuring that the riders are experienced and trained in performing such stunts.",Clarity of Thought: The original thought is focused and relevant to the question. Accuracy: The answer is accurate and aligns with expectations. Detail: The answer lacks sufficient detail.
How might a pedestrian or driver's experience be affected in this city setting?,"This is a much-improved answer. You have identified specific challenges such as traffic congestion, the need for caution due to the high number of pedestrians, and the impact of weather conditions on road safety. However, you could further enhance your answer by mentioning how pedestrians might affect the flow of traffic, such as frequent stops for vehicles at crosswalks and traffic lights.",7,"I need to include more specific challenges that pedestrians and drivers might face in this city setting. I'll mention traffic congestion, the need for caution, and possible weather conditions.","In this city setting, pedestrians and drivers might experience traffic congestion due to the presence of many vehicles, including the red bus. They need to be cautious because of the high number of pedestrians around. Additionally, if there are rainy or icy conditions, it could make the roads slippery and increase the risk of accidents.","In this city setting, pedestrians and drivers might experience traffic congestion due to the presence of many vehicles, including the red bus. Drivers need to be cautious because of the high number of pedestrians around, which might result in more frequent stops at crosswalks and traffic lights. Additionally, if there are rainy or icy conditions, it could make the roads slippery and increase the risk of accidents.",Clarity of Thought: The original thought is focused and relevant to the question. Accuracy: The answer does not fully align with the expected response. Detail: The answer shows improvement but could be more detailed.
How might a player's performance be impacted in a high-pressure baseball game?,"Your answer touches on some important points, such as nervousness and the impact of the crowd's noise. However, it lacks detail on how these factors specifically affect a player's performance. Consider mentioning how stress and anxiety can lead to physical symptoms like increased heart rate and muscle tension, and how these can affect focus and decision-making. Additionally, discuss how players can overcome these challenges through mental resilience and coping strategies.",6,"The image shows a baseball game in progress, which can be a high-pressure situation for the players involved.","In a high-pressure baseball game, a player's performance might be impacted by the need to win and the importance of the game. Players might feel nervous and make mistakes, such as striking out or missing a catch. The crowd's noise can also be distracting and make it harder for players to concentrate.","In a high-pressure baseball game, a player's performance might be impacted by stress and anxiety, which can cause physical symptoms like increased heart rate and muscle tension. These symptoms can lead to a decrease in focus and poor decision-making, such as striking out or missing a catch. The noise from the crowd can also be distracting and make it harder for players to concentrate. To overcome these challenges, players need to develop mental resilience and efficient coping strategies, such as focusing on aspects of the game within their control and trusting in their training and abilities.",Clarity of Thought: The original thought is focused and relevant to the question. Accuracy: The answer does not fully align with the expected response. Detail: The answer lacks sufficient detail.
How might other skiers on the slope influence the young boy's skiing experience?,"Much better! You have provided a more comprehensive answer that includes both the positive aspects of learning from other skiers and the potential risks of overcrowding. You also mentioned the importance of maintaining a safe distance and being aware of surroundings, which is crucial. The only minor improvement could be to mention the camaraderie and mutual support among skiers, which can also enhance the young boy's experience.",9,"I need to provide more details about how other skiers can influence the young boy's skiing experience, including both learning opportunities and potential risks.","Other skiers on the slope can influence the young boy's skiing experience in several ways. Watching them ski might help him learn new techniques and improve his skills. The presence of other skiers can also make the experience more enjoyable and help him feel more confident. On the other hand, if there are too many skiers, it could become overcrowded, making it difficult for him to navigate safely. This increases the risk of collisions or accidents, especially if the other skiers have different skill levels. It is important for the young boy to keep a safe distance from others and be aware of his surroundings.","Other skiers on the slope can influence the young boy's skiing experience in several ways. Watching them ski might help him learn new techniques and improve his skills. The presence of other skiers can also make the experience more enjoyable and help him feel more confident due to the camaraderie and mutual support among skiers. On the other hand, if there are too many skiers, it could become overcrowded, making it difficult for him to navigate safely. This increases the risk of collisions or accidents, especially if the other skiers have different skill levels. It is important for the young boy to keep a safe distance from others, follow skiing etiquette, and be aware of his surroundings.",Clarity of Thought: The original thought is focused and relevant to the question. Accuracy: The answer does not fully align with the expected response. Detail: The answer lacks sufficient detail.
How might someone set their priorities during the day when they notice the time on this clock?,"Much better! Your answer now includes specific examples of tasks and mentions planning the schedule for the day. However, you could further improve by explaining how noticing the time on the clock helps in better time management and productivity.",8,I need to provide more specific examples of tasks and how the person might plan their schedule for the day.,"When someone notices that the clock shows 9:45, they might start prioritizing their morning tasks, such as finishing up any urgent work, replying to important emails, or preparing for a meeting later in the morning. They might also plan out their day by allocating specific time slots for breaks, lunch, and other activities.","When someone notices that the clock shows 9:45, they might start prioritizing their morning tasks, such as finishing up any urgent work, replying to important emails, or preparing for a meeting later in the morning. By planning out their day and allocating specific time slots for breaks, lunch, and other activities, they can better manage their time and increase productivity throughout the day.",Clarity of Thought: The original thought is focused and relevant to the question. Accuracy: The answer does not fully align with the expected response. Detail: The answer lacks sufficient detail.
How might the distribution of stars and the brightness within this image inform us about the structure and dynamics of this galaxy?,"Much better! You have included important details about the star clusters, dust lanes, and the potential supermassive black hole. You also mentioned the regions of star formation and the information that brightness and light distribution can provide about the ages of different parts of the galaxy. To further improve, you could discuss how the spiral structure implies rotation and how this can provide insights into the galaxy's mass distribution and dynamics, such as rotational velocity and gravitational forces.",8,I need to include more details about the spiral arms and the implications of the bright core. I should also mention star formation and the potential supermassive black hole.,"The distribution of stars and brightness in the image suggests a spiral galaxy with a dense, bright core, indicating a high concentration of stars and potentially a supermassive black hole. The spiral arms, which contain star clusters and dust lanes, are regions of star formation. The brightness and distribution of light can also provide information about the ages of different parts of the galaxy.","The distribution of stars and brightness in the image suggests a spiral galaxy with a dense, bright core, indicating a high concentration of stars and potentially a supermassive black hole. The spiral arms, which contain star clusters and dust lanes, are regions of star formation. The pinwheel structure implies rotation, which can provide insights into the galaxy's mass distribution and dynamics, such as rotational velocity and gravitational forces. The brightness and distribution of light can also provide information about the ages of different parts of the galaxy.",Clarity of Thought: The original thought is focused and relevant to the question. Accuracy: The answer does not fully align with the expected response. Detail: The answer lacks sufficient detail.
How might the outcome of this play impact the game?,"Much better! You have included more details about how the outcome of the play can affect the team's chances of winning and their morale. You also mentioned the potential advantage for the opposing team if the batter misses or gets out. To further improve, you could elaborate on how a solid hit might boost team momentum and how individual actions and performances can shift the balance of the game.",8,"I need to consider the broader implications of the play's outcome, such as how it affects the team's chances of winning and their morale.","The outcome of this play might impact the game by determining whether the batter gets on base or not. If the batter gets on base, it could lead to runs being scored, which would improve their team's chances of winning. It could also boost the team's morale. If the batter misses or gets out, it could give an advantage to the opposing team and put pressure on the batting team.","The outcome of this play can significantly impact the baseball game depending on how well the batter reacts to the thrown ball. If the batter successfully hits the ball, it can result in runs scored for their team, improving their chances of winning. A solid hit may also boost team morale and momentum. On the other hand, if the batter misses or gets caught out, this could lead to an increased advantage for the opposing team, putting pressure on the batting team to recover lost ground. The outcome of this play could potentially shift the balance of the game, showcasing the importance of individual actions and performances in determining a team's success.",Clarity of Thought: The original thought is focused and relevant to the question. Accuracy: The answer does not fully align with the expected response. Detail: The answer lacks sufficient detail.
How might the room setup affect the players' gaming experience?,"Your answer has improved and now includes more relevant details such as the positioning of the furniture, space for movement, and accessibility of remotes. However, you could further elaborate on how these factors specifically enhance the gaming experience. For example, you could mention the importance of back support from the furniture and how unrestricted movement is crucial for certain types of games.",7,"I need to consider more aspects of the room setup, such as the positioning of the furniture and the accessibility of the gaming equipment.","The room setup affects the players' gaming experience by providing a comfortable environment with a couch and a chair. If the furniture is positioned at a comfortable distance from the TV screen, it can prevent eye strain. Additionally, having enough space for movement is important, especially for motion-controlled games. The accessibility of remotes also ensures that players can easily switch between games or settings.","The room setup affects the players' gaming experience by providing a comfortable environment with a couch and a chair. If the furniture is positioned at a comfortable distance from the TV screen and provides adequate back support, it can prevent eye strain and discomfort. Additionally, having enough space for unrestricted movement is important, especially for motion-controlled games like those on the Wii. The accessibility of remotes ensures that players can easily switch between games or settings without having to search for them. Overall, a well-designed room setup that optimizes for comfort, ease of movement, and convenient access to gaming equipment can greatly enhance the players' gaming experience.",Clarity of Thought: The original thought is focused and relevant to the question. Accuracy: The answer does not fully align with the expected response. Detail: The answer shows improvement but could be more detailed.
How might the room's atmosphere contribute to the woman's relaxation?,"Much better! You included more details and explained how each element contributes to relaxation. You mentioned the pink theme, the teddy bear, the laptop, the potted plant, and the chair, which are all important aspects. However, you could improve your answer by mentioning the overall layout and how it creates a cozy and inviting environment. Also, consider how the natural light from the windows might contribute to the atmosphere.",8,"I need to include more details about the room and explain how each element contributes to relaxation. I should mention the pink theme, the teddy bear, the potted plant, and the chair.","The room's atmosphere contributes to the woman's relaxation because it has a pink theme that evokes warmth and softness. There is a teddy bear near the bed, which is a symbol of comfort. The laptop can provide entertainment or communication. Additionally, there is a potted plant that adds a touch of nature and a chair that can be used for seating or placing personal belongings.","The room's atmosphere contributes to the woman's relaxation because it has a pink theme that evokes warmth and softness. There is a teddy bear near the bed, which is a symbol of comfort. The laptop can provide entertainment or communication. Additionally, there is a potted plant that adds a touch of nature and a chair that can be used for seating or placing personal belongings. The overall layout of the room is cozy and inviting, and the natural light from the windows enhances the relaxing atmosphere.",Clarity of Thought: The original thought is focused and relevant to the question. Accuracy: The answer does not fully align with the expected response. Detail: The answer lacks sufficient detail.
