question,feedback,score,thought,orig_answer,resub_answer,rubric
How can one make these pancakes a healthier choice?,"Excellent! You have covered almost all the important points. Just one minor addition: you can also consider using a sugar-free syrup option as an alternative to honey. This will provide another healthy option for the syrup. Otherwise, your answer is very thorough and well thought out.",9,I should mention reducing added sugars in the batter and ensuring the bananas and walnuts are fresh and unsweetened.,"To make these pancakes healthier, I would use whole-wheat flour instead of regular flour and reduce or eliminate added sugars in the pancake batter. For the toppings, I would use Greek yogurt instead of whipped cream and honey instead of syrup, but drizzle it sparingly. I would also add fresh fruits like berries and ensure that the bananas and walnuts are fresh and unsweetened.","To make these pancakes healthier, I would use whole-wheat flour instead of regular flour and reduce or eliminate added sugars in the pancake batter. For the toppings, I would use Greek yogurt instead of whipped cream and either honey or a sugar-free syrup option, but drizzle it sparingly. I would also add fresh fruits like berries and ensure that the bananas and walnuts are fresh and unsweetened.",Clarity of Thought: The original thought is focused and relevant to the question. Accuracy: The answer is accurate and aligns with expectations. Detail: The answer is detailed and provides thorough insight.
How can someone better organize the items on the desk?,"Much better! You have included specific suggestions for organizing electronics, books, and papers, which makes your answer more detailed and practical. To further improve, you could mention the benefits of maintaining a clean and clutter-free environment, such as reducing distractions and improving productivity.",8,I need to be more specific about how to organize different types of items on the desk. Mentioning specific tools and methods for each category might help.,"To better organize the items on the desk, the person could start by categorizing the items. For electronics like the laptop, mouse, and cell phones, they could use cable organizers or accessory trays to keep cords and small accessories neatly arranged. For books, a bookshelf or a vertical book stand can help save desk space. Papers can be sorted into folders or document organizers based on their purpose or priority.","To better organize the items on the desk, the person could start by categorizing the items. For electronics like the laptop, mouse, and cell phones, they could use cable organizers or accessory trays to keep cords and small accessories neatly arranged. For books, a bookshelf or a vertical book stand can help save desk space. Papers can be sorted into folders or document organizers based on their purpose or priority. Maintaining a clean and clutter-free environment can help reduce distractions and improve overall efficiency and productivity.",Clarity of Thought: The original thought is focused and relevant to the question. Accuracy: The answer does not fully align with the expected response. Detail: The answer is detailed and provides thorough insight.
How can someone describe the decoration of this bathroom?,Excellent! You have provided a detailed and accurate description of the bathroom. You identified the gorilla in the framed drawing and described the minimalistic nature of the decoration. Your answer is now very close to the groundtruth answer. Just a minor note: you could mention the small space of the bathroom to make your description even more complete.,9,I need to identify the animal in the drawing and describe the minimalistic decoration of the bathroom.,"The bathroom is simple and minimalistic with a toilet, a sink, and some cleaning supplies on the counter. The walls are plain, and there is a framed drawing of a gorilla above the toilet. The choice of artwork is unusual for a bathroom, and the overall decoration is minimalistic with only the basic amenities.","The bathroom is small, simple, and minimalistic with a toilet, a sink, and some cleaning supplies on the counter. The walls are plain, and there is a framed drawing of a gorilla above the toilet. The choice of artwork is unusual for a bathroom, and the overall decoration is minimalistic with only the basic amenities.",Clarity of Thought: The original thought is focused and relevant to the question. Accuracy: The answer is accurate and aligns with expectations. Detail: The answer is detailed and provides thorough insight.
How can someone enhance the reading experience in this living room?,"Much better! Your answer now includes specific suggestions for lighting, comfort, and book organization, which are all important for enhancing the reading experience. To further improve, you could mention the importance of positioning the lamp for optimal lighting and how these additions can encourage spending more time reading and relaxing in the living room.",8,"I need to be more specific about the types of lighting and comfort elements, and also consider other aspects like book organization.","To enhance the reading experience in this living room, one could add a floor lamp near the couch to provide sufficient light for reading. Adding soft cushions or a comfy throw blanket to the couch and chairs would make the space more comfortable. Additionally, incorporating a bookshelf to organize and display books would create a more inviting and personalized reading ambiance.","To enhance the reading experience in this living room, one could add a floor lamp near the couch or chair to provide sufficient light for reading, especially during nighttime or in low-light conditions. Adding soft cushions or a comfy throw blanket to the couch and chairs would make the space more comfortable. Additionally, incorporating a bookshelf to organize and display books would create a more inviting and personalized reading ambiance, encouraging spending extended periods reading and relaxing in the living room.",Clarity of Thought: The original thought is focused and relevant to the question. Accuracy: The answer does not fully align with the expected response. Detail: The answer lacks sufficient detail.
How can someone enjoy the meal while considering their nutritional needs?,"Good job on identifying the importance of including salad for fiber and vitamins, meats for protein, and fruits for additional vitamins and sweetness. However, you missed mentioning portion control and the use of utensils to enjoy the meal comfortably. Also, consider specifying the types of fruits available on the table.",7,"To enjoy the meal while considering nutritional needs, it's important to choose a variety of foods that provide essential nutrients.","One can enjoy the meal by starting with the salad for fiber and vitamins. They can add some of the meats for protein. Including the fruits like peaches and tomatoes will provide additional vitamins and a bit of sweetness. This way, they can have a balanced meal that is both nutritious and enjoyable.","To enjoy the meal while considering nutritional needs, one can start with a portion of the salad for fiber and vitamins. Adding some of the meats will provide essential protein. Including fruits like peaches and tomatoes will add more vitamins and natural sweetness. It's important to focus on portion control to avoid overeating. Using the available utensils, like forks and knives, will help in enjoying the meal comfortably.",Clarity of Thought: The original thought is focused and relevant to the question. Accuracy: The answer does not fully align with the expected response. Detail: The answer lacks sufficient detail.
How can someone make a well-balanced meal with the ingredients in this lunch box?,"Much better! You have now included the healthy fats from the almonds and considered the baked product as a potential source of whole grains. You also mentioned adding a fruit to complete the meal, which is a great addition. Your answer is now very close to the groundtruth. Just ensure that the portions are balanced to meet dietary recommendations.",9,I need to include healthy fats and consider whole grains and fruits to make the meal more balanced.,"To make a well-balanced meal, I would use the cucumber and carrot salad as the base for vegetables. I would add the smoked meat for protein and include the almonds for both protein and healthy fats. The baked product can provide carbs, especially if it is a whole-grain option. Finally, I would add the cherry tomatoes for extra vegetables and consider adding a fruit like an apple or berries on the side for additional vitamins and minerals.","To make a well-balanced meal, I would start with the cucumber and carrot salad as the base for vegetables. I would add a portion of smoked meat for protein and include a handful of almonds for both protein and healthy fats. The baked product can provide carbs, especially if it is a whole-grain option. I would also add the cherry tomatoes for extra vegetables. To complete the meal, I would include a small serving of fruit, such as an apple or a handful of berries, to provide additional vitamins and minerals.",Clarity of Thought: The original thought is focused and relevant to the question. Accuracy: The answer does not fully align with the expected response. Detail: The answer lacks sufficient detail.
How can someone optimize the storage space and functionality in this tiny kitchen?,"This is a much-improved answer. You have included specific strategies such as installing shelves, using drawer dividers, and opting for combination appliances. You also mentioned decluttering and foldable furniture, which are good points. However, you could further enhance your answer by mentioning the use of wall-mounted racks and the importance of regularly decluttering to maintain a functional space.",7,"I need to think about more specific ways to optimize the space, including using vertical space and multi-functional items.","To optimize the storage space and functionality in this tiny kitchen, one could install shelves above the cabinets to use vertical space. Using drawer dividers inside the cabinets can help keep items organized. Additionally, replacing the oven and microwave with a combination appliance can save space. Keeping the kitchen decluttered and using foldable furniture can also help.","To optimize the storage space and functionality in this tiny kitchen, one could install shelves above the cabinets and wall-mounted racks on open walls to use vertical space effectively. Using drawer dividers and organizers inside the cabinets can help keep items tidy and maximize available space. Replacing the oven and microwave with a combination appliance can save counter and storage space. Regularly decluttering the kitchen ensures that only essential items are kept, reducing the overall storage required. Additionally, using foldable furniture, such as a foldable chair and an extendable table, can save floor space when not in use.",Clarity of Thought: The original thought is focused and relevant to the question. Accuracy: The answer does not fully align with the expected response. Detail: The answer shows improvement but could be more detailed.
How can the close proximity of the people to the elephants impact their perception and understanding of the animals?,"Excellent improvement! You have now included the observation of behaviors and interactions, as well as the impact on appreciation and conservation awareness. Your answer is comprehensive and well-rounded. The only minor detail missing is the mention of the sheer scale and majesty of the elephants, which might be difficult to grasp from a distance or through pictures and videos.",9,"I need to include the observation of behaviors and interactions, as well as the impact on appreciation and conservation awareness.","The close proximity allows the people to observe the elephants' size, features, and behaviors more closely. They can see how the elephants interact with each other and notice subtle behaviors that reveal their social dynamics or personalities. This experience can foster a deeper appreciation and respect for the elephants, enhancing their awareness of the importance of conservation efforts and the protection of elephant habitats.","The close proximity allows the people to observe the elephants' size, features, and behaviors more closely. They can see how the elephants interact with each other and notice subtle behaviors that reveal their social dynamics or personalities. From this vantage point, they can appreciate the sheer scale and majesty of the elephants, which might be difficult to grasp from a distance or through pictures and videos. This experience can foster a deeper appreciation and respect for the elephants, enhancing their awareness of the importance of conservation efforts and the protection of elephant habitats.",Clarity of Thought: The original thought is focused and relevant to the question. Accuracy: The answer is accurate and aligns with expectations. Detail: The answer lacks sufficient detail.
How can the design of this living room contribute to its function and the inhabitants' well-being?,"Much better! You have included more details about the furniture and its placement, as well as the variety of activities the room supports. You also mentioned the role of the potted plant in enhancing well-being. To further improve, you could elaborate on how the overall cozy and welcoming atmosphere contributes to the inhabitants' sense of well-being.",8,"I need to mention more details about the furniture placement, the variety of activities, and the role of decorations and plants in enhancing well-being.","The living room's design includes a comfortable couch with several pillows for relaxation, a computer desk for work or study, and various decorations like books and vases that add to the aesthetic appeal. The strategic placement of the furniture allows for different activities, such as watching TV, working, and socializing. The potted plant in the corner adds a touch of nature, which can improve indoor air quality and enhance the residents' well-being.","The living room's design features a comfortable couch with several pillows, a computer desk for work or study, and aesthetically pleasing decorations like books and vases. The strategic placement of furniture allows for various activities, such as relaxation, watching TV, working, and socializing. The potted plant in the corner adds a touch of nature, improving indoor air quality and enhancing well-being. The overall cozy and welcoming atmosphere created by the furniture arrangement and decorations makes the space more enjoyable and induces a sense of well-being for the inhabitants.",Clarity of Thought: The original thought is focused and relevant to the question. Accuracy: The answer does not fully align with the expected response. Detail: The answer lacks sufficient detail.
How can the host enhance the atmosphere for the guests in this living room?,"Great improvement! You have included most of the key elements that can enhance the atmosphere, such as adding cushions and throws, fresh flowers, subtle lighting, and providing books or magazines. One additional suggestion is to consider playing ambient music in the background to add warmth to the space and provide a pleasant atmosphere. Overall, well done!",9,I need to focus on creating a cozy and welcoming environment for the guests.,"The host can enhance the atmosphere by adding more cushions and throws to the couch to create a cozy seating area. They could also place fresh flowers in the vases near the dining table and add subtle lighting, such as candles or warm-toned fairy lights, to create a more intimate atmosphere. Rearranging the sitting area to encourage conversation and providing books or magazines on the small wooden table for guests to read would also help create a more engaging environment.","The host can enhance the atmosphere by adding more cushions and throws to the couch to create a cozy seating area. They could also place fresh flowers in the vases near the dining table and add subtle lighting, such as candles or warm-toned fairy lights, to create a more intimate atmosphere. Rearranging the sitting area to encourage conversation and providing books or magazines on the small wooden table for guests to read would also help create a more engaging environment. Additionally, playing ambient music in the background could add warmth to the space and provide a pleasant atmosphere.",Clarity of Thought: The original thought is focused and relevant to the question. Accuracy: The answer does not fully align with the expected response. Detail: The answer lacks sufficient detail.
How can the layout of the bedroom be improved for a more organized appearance?,"Your answer identifies some good points about reducing clutter by moving the trunk and stool and putting away small items. However, you missed mentioning the books and the remote, which are also contributing to the clutter. Additionally, you did not suggest a specific place for the remote or the books. Consider addressing these items and providing more detailed suggestions for organizing them.",5,The room looks a bit cluttered with various items scattered around. Organizing these items could help improve the layout.,"To improve the bedroom layout, the bed could be moved to a different position to create more space. Additionally, the trunk and the small stool could be placed in a corner to reduce clutter. The cup and other small items on the table should be put away in a cupboard or drawer.","To improve the bedroom layout, the bed could be moved to a different position to create more space. The trunk and the small stool could be placed in a corner to reduce clutter. The books should be placed in a bookshelf or a designated storage space. The remote can be kept on a bedside table or in a specific spot within reach of the bed. The cup and other small items on the table should be put away in a cupboard or drawer.",Clarity of Thought: The original thought is focused and relevant to the question. Accuracy: The answer does not fully align with the expected response. Detail: The answer is detailed and provides thorough insight.
How can the man's outfit choice be perceived in a fashion context?,"Much better! You have included more details about the specific items of clothing and have elaborated on the mix of casual and formal styles. To further improve, you could mention how this outfit choice can be intriguing and stylish to those who appreciate unconventional and individualistic approaches to clothing selection.",8,I need to include more details about the specific items of clothing and how the combination expresses personal style.,"The man's outfit choice of combining a jean jacket vest with a gray shirt and a black bow tie can be perceived as a creative mix of casual and formal attire. The jean jacket vest represents a casual style, while the bow tie is formal. This combination expresses his personal style and demonstrates a unique blend of relaxed and elegant fashion elements.","The man's outfit choice of combining a jean jacket vest, possibly a Levi, with a gray shirt and a black bow tie can be perceived as a creative and non-traditional mix of casual and formal attire. The jean jacket vest represents a casual style, while the bow tie is formal. By wearing both, he is expressing his personal style and demonstrating a unique blend of relaxed and elegant fashion elements. This outfit choice can be intriguing and stylish to those who appreciate unconventional and individualistic approaches to clothing selection.",Clarity of Thought: The original thought is focused and relevant to the question. Accuracy: The answer does not fully align with the expected response. Detail: The answer lacks sufficient detail.
How can the performance of the skier be analyzed and improved based on the onlookers' feedback?,"Much better! You have included more specific aspects such as stability, balance, and execution of the jump, as well as the importance of equipment. However, you could further improve your answer by mentioning how the skier maintains control in mid-air, the angle of takeoff and landing, and the importance of consistent practice and perseverance.",8,I need to include more specific aspects of the skier's performance and mention the equipment and other factors like stability and balance.,"The onlookers can analyze the skier's performance by observing their form, technique, and equipment during the jump. They should pay attention to the skier's stability, balance, and execution of the jump. They can then provide feedback on how to improve these aspects, such as adjusting body position, weight distribution, and timing.","The onlookers can analyze the skier's performance by observing their form, technique, and equipment during the jump. They should pay attention to the skier's stability, balance, and execution of the jump, including how well the skier maintains control in mid-air and the angle of takeoff and landing. They can then provide feedback on how to improve these aspects, such as adjusting body position, weight distribution, and timing. Consistent practice and perseverance are also important for refining skills and achieving better performance.",Clarity of Thought: The original thought is focused and relevant to the question. Accuracy: The answer does not fully align with the expected response. Detail: The answer lacks sufficient detail.
How can the presence of a ferris wheel influence the atmosphere of the park where people are flying kites?,"Much better! You have included more details about the atmosphere and the feelings the ferris wheel evokes. You also mentioned its role as a landmark. To further improve, you could elaborate on how this environment encourages people to engage more with activities like kite flying and how it contributes to a memorable experience for everyone.",8,I need to elaborate more on how the ferris wheel influences the atmosphere and the feelings it evokes. I should also mention its role as a landmark.,"The presence of a ferris wheel in the park creates a festive and lively atmosphere. It attracts people of all ages to the park, making it busier and more vibrant. The ferris wheel adds visual interest and evokes feelings of fun and excitement. It also serves as a landmark, making the park easily identifiable and memorable for visitors.","The presence of a ferris wheel in the park creates a festive and lively atmosphere, attracting people of all ages to take part in various outdoor activities, such as flying kites. Besides adding visual interest to the scene, the ferris wheel evokes feelings of fun, excitement, and leisure that contributes to the overall enjoyment of the park visitors. This environment encourages people to be more engaged with the activities going on in the park, leading to a memorable and enjoyable experience for everyone. Moreover, the ferris wheel can also serve as a landmark that makes the park easily identifiable and attracts more attention, ultimately leading to a higher number of visitors participating in activities like kite flying.",Clarity of Thought: The original thought is focused and relevant to the question. Accuracy: The answer does not fully align with the expected response. Detail: The answer lacks sufficient detail.
How can the presentation of the fruits and spreads contribute to the dining experience?,"Much better! You've included important aspects such as attention to detail, ease of serving, and customization. To further improve, you could mention how this thoughtful arrangement promotes a pleasant and satisfying dining atmosphere.",8,"I need to add more details about how the presentation can improve the dining experience, including the ease of serving and customization.","The presentation of the fruits and spreads in separate bowls makes the food look more appealing and inviting. It shows attention to detail and makes it easier for guests to serve themselves. Guests can also mix and match the fruits and spreads according to their preferences, which can make their dining experience more enjoyable.","The presentation of the fruits and spreads in separate bowls makes the food look more appealing and inviting. It shows attention to detail and makes it easier for guests to serve themselves. Guests can mix and match the fruits and spreads according to their preferences, which enhances their dining experience. This thoughtful arrangement promotes a pleasant and satisfying dining atmosphere.",Clarity of Thought: The original thought is focused and relevant to the question. Accuracy: The answer does not fully align with the expected response. Detail: The answer lacks sufficient detail.
