question,feedback,score,thought,orig_answer,resub_answer,rubric
"Answer the question and provide an explanation.

The question is: What is the biggest risk of this sport?","Much better! You've included more details about the types of injuries and the role of the environment in increasing the risk. You also mentioned the importance of protective gear, which is great. To further improve, you could discuss the need for skaters to practice within their skill level and gradually progress to more difficult maneuvers, as well as being aware of their surroundings and potential hazards.",8,"I need to provide more details about the types of injuries and the environment. Also, mentioning protective gear is important.","The biggest risk of this sport is falling off the skateboard and getting injured. Injuries can include cuts, bruises, fractures, and concussions. The hard concrete surfaces of the skate bowl make falls more dangerous. Wearing protective gear like helmets, knee pads, and elbow pads can help reduce the risk of serious injuries.","The biggest risk of this sport is falling off the skateboard and getting injured. Injuries can include cuts, bruises, fractures, concussions, and even traumatic brain injuries. The hard concrete surfaces of the skate bowl make falls more dangerous. Wearing protective gear like helmets, knee pads, and elbow pads can help reduce the risk of serious injuries. Skaters should practice within their skill level and gradually progress to more difficult maneuvers. It is also important to be aware of their surroundings and potential hazards.",Clarity of Thought: The original thought is focused and relevant to the question. Accuracy: The answer does not fully align with the expected response. Detail: The answer lacks sufficient detail.
"Answer the question and provide an explanation.

The question is: What is the man wearing the baseball cap and sunglasses doing on the mountain?","Much better! You have included important details about his stance, attire, and the use of ski poles. You also explained why he might be wearing sunglasses and a baseball cap. To make your answer perfect, you could add that his dynamic position implies he is proficiently maneuvering at a considerable speed.",9,"I need to provide more details about the man's stance, attire, and the use of ski poles. I should also explain why he might be wearing sunglasses and a baseball cap.","The man wearing the baseball cap and sunglasses is skiing on the mountain. He has an athletic, bent-knee stance and is using ski poles to help with balance and steering. His attire, including the ski suit and boots, is designed for skiing, providing insulation and flexibility. The sunglasses and baseball cap are likely for protecting his eyes from the sun's glare, which is strong and reflected by the snow.","The man wearing the baseball cap and sunglasses is skiing on the mountain. He has an athletic, bent-knee stance and is using ski poles to help with balance and steering. His attire, including the ski suit and boots, is designed for skiing, providing insulation and flexibility. The sunglasses and baseball cap are likely for protecting his eyes from the sun's glare, which is strong and reflected by the snow. His dynamic position implies that he is proficiently maneuvering at a considerable speed.",Clarity of Thought: The original thought is focused and relevant to the question. Accuracy: The answer does not fully align with the expected response. Detail: The answer lacks sufficient detail.
"Answer the question and provide an explanation.

The question is: What kind of precipitation is at the top of the mountain?","Excellent! Your answer is now much more detailed and accurate. You correctly identified snowfall as the type of precipitation and provided a good explanation of why snow is present at the top of the mountain. You could further enhance your answer by mentioning that even in warmer seasons, the highest points of mountains can maintain low enough temperatures for snow to accumulate and remain for extended periods. Great job!",9,"The presence of snow at the top of the mountain indicates that the temperature decreases with altitude, allowing snow to form and persist. This is common in mountainous regions where the peaks reach colder layers of the atmosphere.",The kind of precipitation at the top of the mountain is snowfall. The presence of snow at the peaks suggests that the temperature decreases with altitude and is sufficiently low to allow snow to form and persist. This is common in mountainous regions where the peaks reach into the colder layers of the atmosphere.,"The kind of precipitation at the top of the mountain is snowfall. The presence of snow at the peaks suggests that the temperature decreases with altitude and is sufficiently low to allow snow to form and persist. This is common in mountainous regions where the peaks reach into the colder layers of the atmosphere. Even in warmer seasons, the highest points of mountains can maintain low enough temperatures for snow to accumulate and remain for extended periods, especially in shaded areas or northern-facing slopes.",Clarity of Thought: The original thought is focused and relevant to the question. Accuracy: The answer is accurate and aligns with expectations. Detail: The answer is detailed and provides thorough insight.
"Answer the question and provide an explanation.

The question is: Who would sit here?","Excellent improvement! Your answer now includes more detail and specificity, accurately reflecting the observations from the image. You have correctly identified that the person likely works in a professional or academic setting and engages in tasks that require multitasking, planning, strategizing, or complex problem-solving. The only minor detail missing is the suggestion that the person might be involved in administrative, analytical, or creative duties. Including this would make your answer even more comprehensive.",9,"The multiple screens, digital tablet, and cluttered desk suggest that the person uses various digital platforms and is working on multiple projects. The whiteboard with notes and diagrams indicates planning and problem-solving tasks.","This chair would likely be occupied by someone who works in a professional or academic setting, such as an office worker, researcher, or academician. The presence of multiple screens and a digital tablet suggests they engage in tasks that require multitasking or the use of various digital platforms. The cluttered desk and whiteboard filled with notes and diagrams imply that this person is involved in planning, strategizing, or complex problem-solving.","This chair would likely be occupied by someone who works in a professional or academic setting, such as an office worker, researcher, or academician. The presence of multiple screens and a digital tablet suggests they engage in tasks that require multitasking or the use of various digital platforms. The cluttered desk and whiteboard filled with notes and diagrams imply that this person is involved in planning, strategizing, or complex problem-solving. Additionally, they might be involved in administrative, analytical, or creative duties.",Clarity of Thought: The original thought is focused and relevant to the question. Accuracy: The answer is accurate and aligns with expectations. Detail: The answer lacks sufficient detail.
"Answer the question based on the image.

The question is: How would you cut the vegetables?","Much better! You provided detailed steps for cutting the baby carrots and beets, and you mentioned washing the vegetables and using separate cutting boards. However, you could add more detail about the different ways to cut the beets depending on their intended use, such as slicing into rounds or dicing into cubes. Also, you could mention the benefit of diagonal cuts for the baby carrots.",8,I need to provide more detailed steps for cutting each vegetable and mention washing them and using separate cutting boards.,"To cut the vegetables, I would first wash them thoroughly. For the baby carrots, I would hold one end and make diagonal cuts to create bite-sized pieces. For the fava beans, I would leave them as they are since they are already out of their pods. For the beets, I would trim off the root end and the part where the stem was attached, peel them, and then cut them into wedges. I would also use separate cutting boards for vegetables and raw meats to avoid cross-contamination.","To cut the vegetables, I would first wash them thoroughly. For the baby carrots, I would hold one end and make diagonal cuts to create bite-sized pieces, which can enhance their presentation and increase the surface area for cooking. For the fava beans, I would leave them as they are since they are already out of their pods. For the beets, I would trim off the root end and the part where the stem was attached, peel them, and then cut them into wedges if they are to be roasted, or slice them into rounds or dice them into cubes if they are for salads or pickling. I would also use separate cutting boards for vegetables and raw meats to avoid cross-contamination.",Clarity of Thought: The original thought is focused and relevant to the question. Accuracy: The answer does not fully align with the expected response. Detail: The answer is detailed and provides thorough insight.
"Answer the question based on the image.

The question is: Why would one sit here?","Excellent! You have now included almost all the key points. Your answer is detailed and covers various reasons why someone might choose to sit here. The only minor addition could be the idea of seeking solitude or a break from crowded places, which is implied by the absence of people.",9,"The setting includes a sun umbrella and a lounger, indicating comfort. The sea view is peaceful, and the absence of people suggests quietness. The lighthouse in the distance adds a scenic quality, and the gentle waves create a calming atmosphere.","One might sit here to relax in comfort, enjoy the peaceful sea view, and appreciate the quietness of the place. The lighthouse in the distance adds a picturesque quality, and the gentle waves create a calming atmosphere. It would be a great spot for sunbathing, reading a book, or simply enjoying the natural surroundings.","One might sit here to relax in comfort, enjoy the peaceful sea view, and appreciate the quietness and solitude of the place. The lighthouse in the distance adds a picturesque quality, and the gentle waves create a calming atmosphere. It would be a great spot for sunbathing, reading a book, or simply enjoying the natural surroundings, providing a sense of escape from the hustle and bustle of daily life.",Clarity of Thought: The original thought is focused and relevant to the question. Accuracy: The answer is accurate and aligns with expectations. Detail: The answer is detailed and provides thorough insight.
"Based on the animals present, what can be inferred about the environment?","Much better! You have added more details about the environment and considered the condition of the animals and the presence of other elements like birds. However, you could still improve by mentioning the specific ambiance of the scene and how it supports the coexistence of different animals. Also, consider the human presence indicated by the nearby house and how it contributes to the overall environment.",8,"I need to add more details about the environment and consider other elements in the image. The sheep look comfortable, and there are trees and grass around. The cat might be a pet, and there are also birds present.","The environment is likely a rural or semi-rural area where livestock and domestic animals coexist. The sheep are comfortably laying in the grass, suggesting a natural and safe habitat, possibly on a farm. The cat might be a pet from a nearby house. The presence of birds indicates a healthy ecosystem.","The environment is likely a rural or semi-rural area where livestock and domestic animals coexist. The sheep are comfortably laying in the grass, suggesting a natural and safe habitat, possibly on a farm. The cat might be a pet from a nearby house, which indicates that the area is inhabited by humans who keep animals or live close to livestock grazing areas. The presence of birds adds to the natural ambiance of the scene, indicating a healthy ecosystem where multiple species can thrive together. Overall, it appears to be a calm and serene environment that supports the coexistence of different animals, both domestic and wild.",Clarity of Thought: The original thought is focused and relevant to the question. Accuracy: The answer does not fully align with the expected response. Detail: The answer lacks sufficient detail.
"Based on the color accents, what improvements can be made to make the bathroom design more cohesive?","Your answer correctly identifies the need to focus on the existing colors and suggests adding accessories in those colors, which is a good start. However, you missed the idea of creating a unified color scheme and using one dominant color with the other two as accents. Also, you didn't mention incorporating textiles or decorative elements to enhance the overall aesthetic. Try to think about how to balance the colors to create a cohesive look.",6,"The bathroom has a mix of colors, including orange, blue, and gray. To make it more cohesive, I should focus on these colors.","To make the bathroom design more cohesive, I would suggest painting the walls in a neutral color like white or light gray. This would help the orange, blue, and gray accents stand out more. Additionally, I would add more accessories in these colors, such as a blue soap dispenser, orange towels, and a gray bath mat.","To make the bathroom design more cohesive, I would choose gray as the dominant color for larger elements like the walls or the floor. Then, I would use orange and blue as accent colors for smaller items and decorative details. For example, I could add orange towels, a blue soap dispenser, and a gray bath mat. Additionally, incorporating textiles like a shower curtain or bath mat in these colors would help create a visually harmonious space.",Clarity of Thought: The original thought is focused and relevant to the question. Accuracy: The answer is accurate and aligns with expectations. Detail: The answer lacks sufficient detail.
"Based on the contents of the fax cover sheet, what might be the nature of the business relationship between Jack and Scott?","Your answer is much improved and captures the essence of their professional relationship. You correctly noted the significance of the unmarked checkboxes and the handwritten note. However, you could further elaborate on the specific nature of their interaction, such as the possibility of a sales or contractual agreement process, to provide a more detailed answer.",8,"Scott is an Account Manager at R. J. Reynolds Tobacco Co., and he is sending a signed contract to Jack. The unmarked checkboxes suggest that the matter is not urgent. The handwritten note indicates that Scott is available for further discussion. This implies an ongoing professional relationship.","Jack and Scott have a professional business relationship. Scott, as an Account Manager at R. J. Reynolds Tobacco Co., is sending Jack a signed contract for Kroger in Cincinnati. The unmarked checkboxes suggest the matter is not urgent, and the handwritten note indicates Scott is available for further discussion, implying an ongoing interaction.","Jack and Scott have a professional business relationship. Scott, as an Account Manager at R. J. Reynolds Tobacco Co., is sending Jack a signed contract for Kroger in Cincinnati. The unmarked checkboxes suggest the matter is not urgent, and the handwritten note indicates Scott is available for further discussion. This implies an ongoing interaction, possibly involving sales or contractual agreements.",Clarity of Thought: The original thought is focused and relevant to the question. Accuracy: The answer is accurate and aligns with expectations. Detail: The answer is detailed and provides thorough insight.
"Based on the given image, what could be a possible real-world scenario that this bar chart is attempting to represent?","Your answer correctly identifies the categories and segments in the bar chart. However, the interpretation of ""animal,"" ""excess,"" and ""gyro"" could be more specific. Additionally, the explanation of ""breath,"" ""stairs,"" and ""client"" needs to be more closely related to the categories. Try to think of a scenario where these terms could be more logically connected.",5,"The bar chart has three categories: ""animal,"" ""excess,"" and ""gyro."" Each category is divided into three segments: ""breath,"" ""stairs,"" and ""client."" The lengths of the bars represent the values for each segment within the categories.","This bar chart could represent the distribution of different activities or incidents in a community center. ""Animal"" might refer to activities involving pets, ""excess"" could be related to surplus resources or waste, and ""gyro"" might be a type of exercise class. ""Breath"" could indicate the number of participants with respiratory issues, ""stairs"" could refer to incidents involving stairs, and ""client"" could denote feedback from participants.","This bar chart might represent data from a veterinary clinic. ""Animal"" could refer to different types of animals treated, ""excess"" might indicate surplus medical supplies or treatments, and ""gyro"" could be a type of treatment or equipment used. ""Breath"" could represent the number of respiratory cases, ""stairs"" might refer to injuries related to climbing or falling, and ""client"" could denote feedback from pet owners.",Clarity of Thought: The original thought is focused and relevant to the question. Accuracy: The answer is accurate and aligns with expectations. Detail: The answer lacks sufficient detail.
"Based on the information provided in the image, what can be inferred about the individual's smoking preferences and engagement with brand promotions?","Your answer is mostly accurate but lacks some specific details. You correctly identified the preference for Marlboro cigarettes and engagement with the Marlboro Miles promotion. However, you missed specifying that the individual prefers non-menthol Marlboro cigarettes. Additionally, you should mention that they have not recently purchased any Camel cigarettes that would qualify for promotional offers. Including the specific race event they are interested in and their favorite driver would also enhance your answer.",7,The individual seems to have a preference for Marlboro cigarettes and engages with their promotional programs. They also smoke Camel cigarettes but haven't bought any recently. They are interested in attending race events and have issues with the cost of tickets. They appreciate the quality of items from Marlboro's promotional program but note a long wait time.,The individual prefers Marlboro cigarettes and engages with the Marlboro Miles promotion. They also smoke Camel cigarettes but haven't bought any recently. They are interested in attending race events and have issues with the cost of tickets. They appreciate the quality of items from Marlboro's promotional program but note a long wait time.,The individual prefers non-menthol Marlboro cigarettes and engages with the Marlboro Miles promotion. They also smoke Camel cigarettes but haven't bought any recently that would qualify for promotional offers. They are interested in attending the Hooters 500 race in Charlotte and have issues with the cost of tickets. Their favorite driver is Kyle Petty. They appreciate the quality of items from Marlboro's promotional program but note a long wait time.,Clarity of Thought: The original thought is focused and relevant to the question. Accuracy: The answer is accurate and aligns with expectations. Detail: The answer lacks sufficient detail.
"Based on the items in the photograph, what advice would you give to someone looking to replicate a similar spread?","Your revised answer is much improved. You included the variety of sandwich fillings, the addition of vegetables like carrots with a dip, and the importance of a visually appealing arrangement. However, you could still add a bit more detail about the specific arrangement of the items on the table and the accessibility for guests. This will make your advice even more helpful.",8,"I need to include more details about the sandwich fillings, the vegetables, and the arrangement of the spread.","To replicate a similar spread, you should prepare sandwiches with croissants and a variety of fillings. Include fresh fruits like oranges and pineapples, and add some vegetables like carrots with a dip. Serve a refreshing drink like lemonade. Make sure to arrange everything nicely on the table to make it visually appealing.","To replicate a similar spread, you should prepare sandwiches with croissants and a variety of fillings. Include fresh fruits like oranges and pineapples, and add some vegetables like carrots with a dip. Serve a refreshing drink like lemonade. Arrange the plates and cups nicely on the table, ensuring that they are easily accessible and visually appealing for guests. Place the sandwiches, fruits, and drinks in close proximity to each other for convenience.",Clarity of Thought: The original thought is focused and relevant to the question. Accuracy: The answer does not fully align with the expected response. Detail: The answer shows improvement but could be more detailed.
"Based on the objects observed, what does it suggest about the woman's activities and the environment in which she is working?","Your answer is quite close to the groundtruth. You correctly identified that the woman is working or studying on her laptop and that the environment is a relaxed and comfortable home setting. You also noted the presence of the keyboard, mouse, and bottle. However, you could improve your answer by mentioning that the woman prefers a casual workspace and emphasizing the importance of taking care of oneself in such an informal workspace. Additionally, you could mention that the couch and the way she is sitting suggest a preference for a casual workspace.",8,"The woman is sitting on a couch with a laptop on her lap. There are several items around her, including a keyboard, mouse, and a bottle.",The woman is likely working or studying on her laptop while sitting on a couch. The presence of the keyboard and mouse suggests she might be doing tasks that require more precise input. The bottle indicates she is staying hydrated. This environment appears to be a relaxed and comfortable home setting.,The woman is engaged in a work or study session on her laptop while sitting on a couch. The presence of the keyboard and mouse suggests she might need more precise input methods. The bottle indicates she is staying hydrated. This setup implies that she prefers a casual workspace and emphasizes the importance of taking care of oneself in an informal workspace.,Clarity of Thought: The original thought is focused and relevant to the question. Accuracy: The answer is accurate and aligns with expectations. Detail: The answer lacks sufficient detail.
"Based on this image, how can the quality of the fruits be described?",Much better! You have now included the significant browning of the bananas and the contrast between the fresh apples and the overripe bananas. This provides a more complete and accurate description of the quality of the fruits. Just a minor note: you could also mention that the bananas might have been in the basket for a longer period or ripen faster than the apples to add more context.,9,"I need to mention that the bananas are more than just ripening; they might be overripe or starting to rot. Also, I should highlight the contrast between the fresh apples and the overripe bananas.","The quality of the fruits in this image can be described as varied. The apples are shiny and fresh, indicating good condition. However, the bananas are significantly browning, which suggests they might be overripe or starting to rot. This contrast shows that the apples are fresh, while the bananas are not in the best condition.","The quality of the fruits in this image can be described as varied. The apples are shiny and fresh, indicating good condition. However, the bananas are significantly browning, which suggests they might be overripe or starting to rot. This contrast shows that the apples are fresh, while the bananas are not in the best condition. The bananas might have been in the basket for a longer period, or they could simply ripen faster than the apples.",Clarity of Thought: The original thought is focused and relevant to the question. Accuracy: The answer does not fully align with the expected response. Detail: The answer lacks sufficient detail.
